{
  "$schema": "./bundles.schema.json",
  "repo": "alimtvnetwork/coding-guidelines-v24",
  "rawBase": "https://raw.githubusercontent.com/alimtvnetwork/coding-guidelines-v24/main",
  "releaseBase": "https://github.com/alimtvnetwork/coding-guidelines-v24/releases",
  "bundles": [
    {
      "name": "error-manage",
      "title": "Error Management Spec",
      "description": "Installs the error-management guidance plus the spec-authoring guide.",
      "intent": [
        "error handling",
        "apperror",
        "response envelope",
        "error codes",
        "typed query",
        "exception",
        "panic",
        "stack trace"
      ],
      "audience": "backend",
      "folders": [
        {
          "src": "02-spec/01-spec-authoring-guide",
          "dest": "02-spec/01-spec-authoring-guide"
        },
        {
          "src": "02-spec/03-error-manage",
          "dest": "02-spec/03-error-manage"
        },
        {
          "src": "version.json",
          "dest": "version.json"
        },
        {
          "src": ".ai-memory/what-to-read.md",
          "dest": ".ai-memory/what-to-read.md"
        },
        {
          "src": ".ai-memory/memory",
          "dest": ".ai-memory/memory"
        }
      ],
      "archive": {
        "stableName": "error-manage",
        "versionedPrefix": "coding-guidelines-error-manage"
      }
    },
    {
      "name": "splitdb",
      "title": "Split-DB Architecture Spec",
      "description": "Installs the database conventions, split-DB architecture, and seedable config specs.",
      "intent": [
        "database",
        "sqlite",
        "split db",
        "root app session",
        "rbac",
        "casbin",
        "seedable config",
        "schema",
        "migration",
        "wal"
      ],
      "audience": "backend",
      "folders": [
        {
          "src": "02-spec/04-database-conventions",
          "dest": "02-spec/04-database-conventions"
        },
        {
          "src": "02-spec/05-split-db-architecture",
          "dest": "02-spec/05-split-db-architecture"
        },
        {
          "src": "02-spec/06-seedable-config-architecture",
          "dest": "02-spec/06-seedable-config-architecture"
        },
        {
          "src": "version.json",
          "dest": "version.json"
        },
        {
          "src": ".ai-memory/what-to-read.md",
          "dest": ".ai-memory/what-to-read.md"
        },
        {
          "src": ".ai-memory/memory",
          "dest": ".ai-memory/memory"
        }
      ],
      "archive": {
        "stableName": "splitdb",
        "versionedPrefix": "coding-guidelines-splitdb"
      }
    },
    {
      "name": "slides",
      "title": "Slides App + Decks",
      "description": "Installs the slides Vite app, the source decks (spec-slides/), and the pre-built dist/ so index.html opens directly in the browser \u2014 no Node/build step required.",
      "intent": [
        "slides",
        "presentation",
        "training",
        "deck",
        "teach",
        "workshop",
        "onboarding"
      ],
      "audience": "trainer",
      "folders": [
        {
          "src": "spec-coding-guideline",
          "dest": "spec-coding-guideline"
        },
        {
          "src": "slides-app",
          "dest": "slides-app"
        },
        {
          "src": "version.json",
          "dest": "version.json"
        },
        {
          "src": ".ai-memory/what-to-read.md",
          "dest": ".ai-memory/what-to-read.md"
        },
        {
          "src": ".ai-memory/memory",
          "dest": ".ai-memory/memory"
        }
      ],
      "archive": {
        "stableName": "slides",
        "versionedPrefix": "coding-guidelines-slides"
      },
      "prebuilt": {
        "src": "slides-app/dist",
        "dest": "slides-app/dist",
        "build": "cd slides-app && bun install --frozen-lockfile && bun run build"
      },
      "autoOpen": {
        "entry": "slides-app/dist/index.html"
      },
      "verify": [
        {
          "path": "slides-app/dist/index.html",
          "kind": "file"
        },
        {
          "path": "spec-slides",
          "kind": "dir"
        }
      ]
    },
    {
      "name": "linters",
      "title": "Linters + CI/CD Linter Pack",
      "description": "Installs the project linters and the CI/CD linter runner pack.",
      "intent": [
        "lint",
        "linter",
        "static analysis",
        "golangci-lint",
        "phpcs",
        "sonarqube",
        "stylecop",
        "ci checks",
        "code quality"
      ],
      "audience": "devops",
      "folders": [
        {
          "src": "linters",
          "dest": "linters"
        },
        {
          "src": "linters-cicd",
          "dest": "linters-cicd"
        },
        {
          "src": "version.json",
          "dest": "version.json"
        },
        {
          "src": ".ai-memory/what-to-read.md",
          "dest": ".ai-memory/what-to-read.md"
        },
        {
          "src": ".ai-memory/memory",
          "dest": ".ai-memory/memory"
        }
      ],
      "archive": {
        "stableName": "linters",
        "versionedPrefix": "coding-guidelines-linters"
      }
    },
    {
      "name": "cli",
      "title": "CLI Toolchain Spec",
      "description": "Installs the CLI-related spec folders (PowerShell, CI/CD, generic CLI, update, distribution, generic release).",
      "intent": [
        "cli",
        "command line",
        "powershell",
        "self update",
        "release pipeline",
        "install script",
        "cross platform",
        "distribution",
        "binary"
      ],
      "audience": "devops",
      "folders": [
        {
          "src": "02-spec/11-powershell-integration",
          "dest": "02-spec/11-powershell-integration"
        },
        {
          "src": "02-spec/12-cicd-pipeline-workflows",
          "dest": "02-spec/12-cicd-pipeline-workflows"
        },
        {
          "src": "02-spec/13-generic-cli",
          "dest": "02-spec/13-generic-cli"
        },
        {
          "src": "02-spec/14-update",
          "dest": "02-spec/14-update"
        },
        {
          "src": "02-spec/15-distribution-and-runner",
          "dest": "02-spec/15-distribution-and-runner"
        },
        {
          "src": "02-spec/16-generic-release",
          "dest": "02-spec/16-generic-release"
        },
        {
          "src": "version.json",
          "dest": "version.json"
        },
        {
          "src": ".ai-memory/what-to-read.md",
          "dest": ".ai-memory/what-to-read.md"
        },
        {
          "src": ".ai-memory/memory",
          "dest": ".ai-memory/memory"
        }
      ],
      "archive": {
        "stableName": "cli",
        "versionedPrefix": "coding-guidelines-cli"
      }
    },
    {
      "name": "wp",
      "title": "WordPress Plugin How-To Spec",
      "description": "Installs the WordPress plugin authoring spec into 02-spec/18-wp-plugin-how-to.",
      "intent": [
        "wordpress",
        "wp plugin",
        "rest api",
        "php traits",
        "gold standard",
        "enums",
        "wp rest"
      ],
      "audience": "wp-plugin",
      "folders": [
        {
          "src": "02-spec/18-wp-plugin-how-to",
          "dest": "02-spec/18-wp-plugin-how-to"
        },
        {
          "src": "version.json",
          "dest": "version.json"
        },
        {
          "src": ".ai-memory/what-to-read.md",
          "dest": ".ai-memory/what-to-read.md"
        },
        {
          "src": ".ai-memory/memory",
          "dest": ".ai-memory/memory"
        }
      ],
      "archive": {
        "stableName": "wp",
        "versionedPrefix": "coding-guidelines-wp"
      }
    },
    {
      "name": "consolidated",
      "title": "Consolidated Guidelines",
      "description": "Installs the spec-authoring guide, error-manage spec, and consolidated guidelines bundle.",
      "intent": [
        "everything",
        "all rules",
        "consolidated",
        "master reference",
        "ai onboarding",
        "complete spec"
      ],
      "audience": "ai-agent",
      "folders": [
        {
          "src": "02-spec/01-spec-authoring-guide",
          "dest": "02-spec/01-spec-authoring-guide"
        },
        {
          "src": "02-spec/03-error-manage",
          "dest": "02-spec/03-error-manage"
        },
        {
          "src": "02-spec/17-consolidated-guidelines",
          "dest": "02-spec/17-consolidated-guidelines"
        },
        {
          "src": "version.json",
          "dest": "version.json"
        },
        {
          "src": ".ai-memory/what-to-read.md",
          "dest": ".ai-memory/what-to-read.md"
        },
        {
          "src": ".ai-memory/memory",
          "dest": ".ai-memory/memory"
        },
        {
          "src": ".ai-memory/coding-guidelines.md",
          "dest": ".ai-memory/coding-guidelines.md"
        },
        {
          "src": "01-prompts",
          "dest": "01-prompts"
        },
        {
          "src": "03-ai-scripts",
          "dest": "03-ai-scripts"
        },
        {
          "src": ".ai-memory/plans",
          "dest": ".ai-memory/plans"
        },
        {
          "src": ".ai-memory/issues",
          "dest": ".ai-memory/issues"
        },
        {
          "src": ".ai-memory/cicd-issues",
          "dest": ".ai-memory/cicd-issues"
        },
        {
          "src": ".agents/skills",
          "dest": ".agents/skills"
        },
        {
          "src": ".agents/scripts",
          "dest": ".agents/scripts"
        },
        {
          "src": ".ai-memory/strictly-avoid.md",
          "dest": ".ai-memory/strictly-avoid.md"
        }
      ],
      "archive": {
        "stableName": "consolidated",
        "versionedPrefix": "coding-guidelines-consolidated"
      }
    }
  ]
}
